mysql> SELECT * FROM STUDENT;
+-------+---------+--------+------------+------------+------------+
| regno | name    | gender | DOB        | mobileNo   | city       |
+-------+---------+--------+------------+------------+------------+
|   101 | Arun    | M      | 2005-01-10 | 9876543210 | Salem      |
|   102 | Priya   | F      | 2005-03-15 | 9876543211 | Chennai    |
|   103 | Karthik | M      | 2004-11-20 | 9876543212 | Coimbatore |
|   104 | Divya   | F      | 2005-07-08 | 9876543213 | Madurai    |
|   105 | Ramesh  | M      | 2004-12-05 | 9876543214 | Salem      |
+-------+---------+--------+------------+------------+------------+
5 rows in set (0.00 sec)

mysql> UPDATE STUDENT
    -> SET Name = 'Aravind'
    -> WHERE RegNo = 101;
Query OK, 1 row affected (0.03 sec)
Rows matched: 1  Changed: 1  Warnings: 0

mysql> SELECT * FROM STUDENT
    -> WHERE RegNo = 101;
+-------+---------+--------+------------+------------+-------+
| regno | name    | gender | DOB        | mobileNo   | city  |
+-------+---------+--------+------------+------------+-------+
|   101 | Aravind | M      | 2005-01-10 | 9876543210 | Salem |
+-------+---------+--------+------------+------------+-------+
1 row in set (0.00 sec)

mysql> SELECT * FROM FACULTY;
+-------+---------+--------+------------+------------+------------+------+
| FacNo | FacName | Gender | DOB        | DOJ        | MobileNo   | Dept |
+-------+---------+--------+------------+------------+------------+------+
| F001  | Mohan   | M      | 1980-05-10 | 2010-06-15 | 9876500001 | CSE  |
| F002  | Kamal   | M      | 1982-08-20 | 2012-07-12 | 9876500002 | ECE  |
| F003  | Anitha  | F      | 1985-09-15 | 2015-06-18 | 9876500003 | IT   |
+-------+---------+--------+------------+------------+------------+------+
3 rows in set (0.00 sec)

mysql> DELETE FROM FACULTY
    -> WHERE FacNo = 'F003';
Query OK, 1 row affected (0.03 sec)

mysql> SELECT * FROM FACULTY;
+-------+---------+--------+------------+------------+------------+------+
| FacNo | FacName | Gender | DOB        | DOJ        | MobileNo   | Dept |
+-------+---------+--------+------------+------------+------------+------+
| F001  | Mohan   | M      | 1980-05-10 | 2010-06-15 | 9876500001 | CSE  |
| F002  | Kamal   | M      | 1982-08-20 | 2012-07-12 | 9876500002 | ECE  |
+-------+---------+--------+------------+------------+------------+------+
2 rows in set (0.00 sec)

mysql> UPDATE FACULTY
    -> SET DOB = '1967-05-10'
    -> WHERE FacName = 'Mohan';
Query OK, 1 row affected (0.03 sec)
Rows matched: 1  Changed: 1  Warnings: 0

mysql> SELECT * FROM FACULTY
    -> WHERE FacName = 'Mohan';
+-------+---------+--------+------------+------------+------------+------+
| FacNo | FacName | Gender | DOB        | DOJ        | MobileNo   | Dept |
+-------+---------+--------+------------+------------+------------+------+
| F001  | Mohan   | M      | 1967-05-10 | 2010-06-15 | 9876500001 | CSE  |
+-------+---------+--------+------------+------------+------------+------+
1 row in set (0.00 sec)

mysql> DELETE FROM FACULTY
    -> WHERE TIMESTAMPDIFF(YEAR, DOB, CURDATE()) > 65;
Query OK, 0 rows affected (0.02 sec)

mysql> SELECT * FROM FACULTY;
+-------+---------+--------+------------+------------+------------+------+
| FacNo | FacName | Gender | DOB        | DOJ        | MobileNo   | Dept |
+-------+---------+--------+------------+------------+------------+------+
| F001  | Mohan   | M      | 1967-05-10 | 2010-06-15 | 9876500001 | CSE  |
| F002  | Kamal   | M      | 1982-08-20 | 2012-07-12 | 9876500002 | ECE  |
+-------+---------+--------+------------+------------+------------+------+
2 rows in set (0.00 sec)

mysql> SELECT * FROM STUDENT;
+-------+---------+--------+------------+------------+------------+
| regno | name    | gender | DOB        | mobileNo   | city       |
+-------+---------+--------+------------+------------+------------+
|   101 | Aravind | M      | 2005-01-10 | 9876543210 | Salem      |
|   102 | Priya   | F      | 2005-03-15 | 9876543211 | Chennai    |
|   103 | Karthik | M      | 2004-11-20 | 9876543212 | Coimbatore |
|   104 | Divya   | F      | 2005-07-08 | 9876543213 | Madurai    |
|   105 | Ramesh  | M      | 2004-12-05 | 9876543214 | Salem      |
+-------+---------+--------+------------+------------+------------+
5 rows in set (0.00 sec)

mysql>
mysql> SELECT * FROM FACULTY;
+-------+---------+--------+------------+------------+------------+------+
| FacNo | FacName | Gender | DOB        | DOJ        | MobileNo   | Dept |
+-------+---------+--------+------------+------------+------------+------+
| F001  | Mohan   | M      | 1967-05-10 | 2010-06-15 | 9876500001 | CSE  |
| F002  | Kamal   | M      | 1982-08-20 | 2012-07-12 | 9876500002 | ECE  |
+-------+---------+--------+------------+------------+------------+------+
2 rows in set (0.00 sec)

mysql>